Modification Request,Solution,Version Name,Build Time
"Cập nhật logic cột Y (Số ngày không nhập): nếu hiệu số ngày > 90 hoặc không có giá trị số (None, '>90') thì điền '>90'. Đóng gói tool hoàn chỉnh thành bản di động.",Sửa hàm compute_row trong tool_do_du_lieu.py. Chuẩn bị file batch chạy cục bộ và cấu hình pyinstaller đóng gói thành file exe di động.,v1.0.1,2026-07-06 22:43:09
"Sửa lỗi layout che khuất nút bấm (footer) của giao diện, thêm định dạng tự động dấu phẩy tiền tệ khi nhập số tiền tham chiếu, tối ưu hóa file bat tránh treo do proxy.",Đảo ngược thứ tự pack của footer và content. Bind sự kiện KeyRelease/FocusOut để định dạng tiền tệ và loại bỏ dấu phẩy trước khi tính toán. Cập nhật các file bat và đồng bộ thư mục Portable.,v1.0.2,2026-07-06 22:52:56
Sửa lỗi kết quả lọc bị trống trên một số tệp RSM (như Lê Duy Đức.xlsx) do lệch cột (thiếu cột map ở đầu). Đóng gói và cập nhật bản portable.,"Nâng cấp tool_do_du_lieu.py để tự động dò tìm vị trí cột dựa trên tiêu đề ở Row 2, chuẩn hóa dữ liệu đầu vào trước khi tính toán. Đồng bộ bản di động.",v1.0.3,2026-07-07 00:08:58
"Tối ưu hóa hiệu năng xử lý, đẩy nhanh tốc độ chạy tool lên gấp 5-6 lần. Đóng gói bản di động.","Nâng cấp tool_do_du_lieu.py sang kiến trúc xử lý 1 lượt (one-pass stream), tối ưu hóa việc chuyển đổi số và hạn chế đối tượng style openpyxl. Cập nhật bản portable.",v1.1.0,2026-07-07 00:19:14
"Sửa lỗi tool không khởi chạy được khi click đúp file batch hoặc dùng pythonw.exe do lỗi AttributeError của sys.stdout.reconfigure trong môi trường không console.","Thêm kiểm tra sys.stdout is not None trước khi reconfigure encoding. Cấu hình Chay_Tool.bat tự động fallback sang python_embed nếu không có python hệ thống.",v1.2.1,2026-07-07 10:55:00
"Cập nhật logic xử lý ô trống cột Last GR và Last Sale: nếu để trống thì điền '>90' và áp dụng công thức tính toán tiếp theo.","Thay đổi logic compute_row nhận diện ô None/trống làm '>90', đồng thời cập nhật ghi đè '>90' cho cột W và X tương ứng trong file Excel đầu ra.",v1.2.2,2026-07-07 13:10:00
Tích hợp giao diện Dashboard tương tác ngoại tuyến (Offline HTML Dashboard) với đầy đủ các bộ lọc và biểu đồ phân tích.,Bổ sung template HTML và viết logic tiêm dữ liệu JSON thô (rawData) trực tiếp vào tệp HTML đầu ra.,v1.3.0,2026-07-08 22:00:00
"Hỗ trợ tự động phân tích dữ liệu đa luồng cho Store List nhiều sheet, chuyển đổi vai trò ASM/RSM sang GĐV/GĐM/Siêu thị.","Đọc nhiều sheet Store List, ánh xạ động vai trò quản lý. Loại bỏ dữ liệu rác không có MCH2/MCH3.",v1.4.0,2026-07-08 23:30:00
Sửa lỗi crash NoneType dữ liệu trống và lỗi hiển thị bộ lọc Siêu thị trong dashboard.,Thêm kiểm tra an toàn NoneType khi làm sạch dữ liệu. Điều chỉnh điều kiện lọc trong template HTML.,v1.4.1,2026-07-09 00:30:00
Đồng bộ nhãn ngày cập nhật tiêu đề Dashboard trùng khớp ngày mốc Y1.,Truyền biến ngày mốc Y1 được chọn vào hàm sinh template HTML thay vì lấy ngày chạy hiện tại.,v1.4.2,2026-07-09 08:30:00
"Cài mặc định giao diện Sáng cho Dashboard và đổi màu biểu đồ sang pastel dịu, tăng tương phản chữ số.","Thêm lớp light mặc định vào body và đổi mã màu Hex sang hệ màu Pastel dịu, bổ sung CSS tăng độ sắc nét cho số liệu.",v1.4.3,2026-07-09 09:00:00
Khắc phục nút bấm mờ và khó nhìn ở giao diện sáng.,Đổi nền xám tối của các nút sang nền Pastel Lavender nhạt (#eef2ff) và chữ Xanh Indigo đậm (#4f46e5).,v1.4.4,2026-07-09 09:20:00
"Sửa lỗi Tooltip số tiền bị che khuất ở đỉnh các cột biểu đồ cao. Sửa lỗi cú pháp Batch script khi chạy trong thư mục có khoảng trắng.","Giới hạn chiều cao tối đa của các cột biểu đồ xuống 30px để tạo khoảng không hiển thị Tooltip đầy đủ. Bọc dấu nháy và sửa ký tự ngoặc đơn trong tệp .bat.",v1.4.5,2026-07-09 10:10:00
"Tích hợp công cụ Tổng quan chuỗi dạng Tab; hỗ trợ lựa chọn tiêu đề chuỗi báo cáo; thiết kế biểu đồ mặc định sáng và tooltip chi tiết; tối giản hóa file html tổng quan.","Gộp 2 tool thành tool_do_du_lieu.py bằng ttk.Notebook. Thêm combobox tên chuỗi. Cập nhật tooltip biểu đồ cột tổng hợp 4 nhóm cảnh báo.",v1.5.0,2026-07-09 15:20:00
"Sửa lỗi không khởi chạy batch script; sửa lỗi nạp file Master xlsx & crash max_rows; hỗ trợ định tuyến file CSV; sửa bộ lọc QLKV hiển thị theo mã store.","Tối giản tệp bat không dùng dấu tiếng Việt. Chuyển load_product_details sang openpyxl và chuẩn hóa 9 phần tử. Đổi max_rows thành max_row. Tích hợp process_csv_file. Đổi logic updateCharts nhóm theo d.store_code khi chọn ASM.",v1.5.1,2026-07-09 16:10:00
Xử lý file CSV/xlsx chậm ở Tab 1 và tổng hợp chuỗi bị kẹt ở Tab 2; cột dữ liệu thô bị trống khi xử lý input .xlsx.,"Tab 1: bỏ bước giải nén+parse XML thô dư thừa trong process_excel_file (chỉ dùng để dò dòng header), tính shelf_life_map 1 lần/batch, sửa lỗi tra cứu h_map khiến các cột Store Code/MCH2-3-4/Tồn đầu kỳ/Nhập-Xuất trong kỳ/Giá vốn/Tồn D-15 bị None. Tab 2: đọc song song các file *(done).xlsx bằng ThreadPoolExecutor. Sửa excel_date_to_datetime để nhận diện ngày dạng số serial Excel trước khi thử strptime. Đã thử nghiệm bundle lxml, đo thực tế không có lợi ích nên không đưa vào bản portable. Đóng gói lại Tool_PhanTichTonKho_Portable_v1.5.3.zip (không kèm raw mẫu).",v1.5.3,09-07-2026 22:40:00
"Bổ sung bộ lọc Slicer Phân loại 3 (MCH3), Phân loại 4 (MCH4), Nhóm hàng (MCH5) vào Dashboard Tổng Quan Chuỗi (Tab 2); đổi đơn vị tiền tệ hiển thị trên toàn bộ dashboard sang Triệu đồng (tr).","Ghi thêm cột 'Nhóm hàng (MCH5)' vào cuối file *(done).xlsx ở process_csv_file & process_excel_file (không thay đổi độ dài row_list để giữ tương thích Tab 1). Đọc thêm MCH3 Desc/MCH4 ID/Nhóm hàng (MCH5) theo tên cột trong _read_single_done_file. Bổ sung mch3/mch4/mch5 vào khóa gộp và kết quả read_and_aggregate_files. Build mchX_list/idx_map và nhúng mch3_idx/mch4_idx/mch5_idx vào JSON trong generate_overview_html. Thêm 3 dropdown slicer + logic lọc phân cấp theo MCH2 trong dashboard_tong_quan. Đổi formatMoney ở cả 2 template chia 1.000.000 và hậu tố ' tr', cập nhật ghi chú 'Đơn vị: Triệu đồng (tr)'. CSV export vẫn giữ giá trị thô VND. Đồng bộ template ra 4 vị trí và bản portable.",v1.5.4,10-07-2026 01:36:00
"Đổi cột MCH4_ID -> MCH4_Desc và đổi tên cột MCH5 thành 'MCH5 Desc' trong file *(done).xlsx; đảm bảo slicer MCH4/MCH5 chỉ liệt kê giá trị thực có trong dữ liệu (không kéo toàn bộ mã Master); bảo đảm tool luôn dùng đúng template v2 mới.","load_product_details nối thêm mch4_desc (cột U/index 20 của Master) ở cuối tuple product_map để không xê dịch index cũ. process_csv_file & process_excel_file ghi mch4_desc vào cột J (đổi header 'MCH4 ID'->'MCH4 Desc') và đổi header cột nhóm hàng thành 'MCH5 Desc'. _read_single_done_file đọc theo header mới có fallback header cũ. Thêm .filter loại giá trị rỗng khi populate slicer MCH3/4/5 ở cả 2 dashboard (danh sách vốn đã build từ dữ liệu *(done)). Sửa thứ tự tìm template: generate_html_dashboard ưu tiên BASE_DIR trước thư mục dữ liệu; generate_overview_html bỏ đường dẫn D:\ cứng, ưu tiên BASE_DIR rồi bản portable. Đã kiểm thử end-to-end Tab 2: mch4_list/mch5_list nhả đúng mô tả, chỉ chứa dữ liệu thực.",v1.5.5,10-07-2026 01:55:00
"Khắc phục: cột 'MCH4 Desc' rỗng và thiếu/không đúng 'MCH5 Desc' trong file *(done) mới; sửa lỗi phân loại sai do nối thêm trường; đảm bảo dashboard sinh ra dùng đúng template v2.","NGUYÊN NHÂN GỐC: (1) cache pickle product_map cũ (.Master..._cache.pkl) lưu tuple 9 phần tử chưa có mch4_desc, mà _is_cache_valid chỉ so mtime nên nạp nhầm dữ liệu cũ -> MCH4 Desc rỗng. (2) ref_date = p_info[-1] dựa vào date_num là phần tử cuối, nhưng mch4_desc được nối vào cuối tuple làm [-1] trỏ nhầm sang chuỗi -> lỗi/lệch phân loại. KHẮC PHỤC: thêm CACHE_SCHEMA_VERSION=2 vào tên file cache (._cache_v2.pkl) để cache cũ tự bị bỏ qua khi đổi cấu trúc tuple; xoá cache cũ. Đổi ref_date sang p_info[8] (index date_num tường minh). Đã kiểm thử end-to-end process_excel_file với Master thật: cột J='MCH4 Desc' và cột cuối='MCH5 Desc' đều điền đúng mô tả tiếng Việt (vd 'Điện gia dụng nhà bếp' / 'Máy xay, Máy ép'). Đồng bộ script + template v2 ra bản portable.",v1.5.6,10-07-2026 02:20:00
